{
  "schema_version": "1.0.0",
  "trip_id": "trip-fixture-direct",
  "traveler_ref": "traveler-synthetic-001",
  "confirmation_codes": ["NX4K7Q"],
  "legs": [
    {
      "leg_id": "leg-fixture-direct-1",
      "marketing_carrier": "NB",
      "operating_carrier": "NB",
      "flight_number": "NB204",
      "origin": "LHR",
      "destination": "AMS",
      "scheduled_departure_at": "2026-09-15T08:20:00Z",
      "scheduled_arrival_at": "2026-09-15T09:35:00Z"
    }
  ]
}
